{"dataset_id":"40f9dc98d92b65c80575","design_parameters":["aspect_ratio","rotation_deg","scale","reynolds"],"fit_dtype":"float64","input_channels":["sdf_over_reference_diameter","reynolds_affine"],"model_dtype":"float32","output_channels":["u_mean","v_mean","rho_delta"],"outputs":{"rho_delta":{"floored":false,"mean":0.0,"raw_standard_deviation":1.0,"standard_deviation":1.0},"u_mean":{"floored":false,"mean":0.0,"raw_standard_deviation":1.0,"standard_deviation":1.0},"v_mean":{"floored":false,"mean":0.0,"raw_standard_deviation":1.0,"standard_deviation":1.0}},"reynolds_range":[40.0,300.0],"schema_version":1,"sdf_clip":[-1.0,1.0],"sdf_reference_diameter_lu":16.0,"spatial_shape":[320,256],"standard_deviation_floor":1e-06,"stored_field_dtype":"float16","training_case_count":1,"training_cell_count":81920,"training_split":"train"}